{
  "id": "7e8f9506-1829-4d3e-7485-9607182940516",
  "code": "CALC-ADNOTURNO-001",
  "slug": "adicional-noturno",
  "version": "1.0.0",
  "status": "published",
  "seo": {
    "title": "Calculadora de Adicional Noturno",
    "description": "Calcule o valor do adicional noturno (CLT) a partir do salário base, horas trabalhadas em período noturno e percentual aplicável. Ferramenta gratuita.",
    "canonical": "https://www.calculadorasdeenfermagem.com.br/adicional-noturno.html"
  },
  "breadcrumb": { "category": "Cálculos Trabalhistas", "categoryHref": "index.html#calculadoras" },
  "overview": {
    "name": "Calculadora de Adicional Noturno",
    "acronym": "Adicional Noturno",
    "categoryBadge": "Cálculos trabalhistas",
    "icon": "i-calculator",
    "objective": "Estimar o valor do adicional noturno devido ao trabalhador que presta serviços em horário noturno, conforme a legislação trabalhista.",
    "indication": "Útil para profissionais de enfermagem e demais trabalhadores que atuam em escalas noturnas, para conferência do valor recebido em holerite.",
    "targetPopulation": "Trabalhadores urbanos ou rurais que prestam serviço em horário considerado noturno pela legislação.",
    "specialty": ["Gestão em Enfermagem", "Departamento Pessoal"],
    "averageTime": "1-2 minutos",
    "evidenceLevel": "III",
    "organizations": ["CLT"],
    "complexity": "basic",
    "rating": 4.5,
    "ratingCount": 180
  },
  "calculator": {
    "inputs": [
      {"id": "salario_base", "type": "number", "label": "Salário Base", "unit": "R$", "defaultValue": 2500, "min": 0, "step": 0.01,
       "description": "Salário base mensal do trabalhador, sem outros adicionais."},
      {"id": "horas_noturnas", "type": "number", "label": "Horas Trabalhadas em Período Noturno", "unit": "horas", "defaultValue": 30, "min": 0, "step": 0.5,
       "description": "Total de horas de relógio trabalhadas em horário noturno no mês (urbano: 22h às 5h)."},
      {"id": "percentual_adicional", "type": "select", "label": "Percentual do Adicional", "defaultValue": 20,
       "description": "Percentual legal mínimo do adicional noturno. Verifique se a convenção coletiva da categoria prevê percentual maior.",
       "options": [
         {"value": 20, "label": "20% — Trabalho Urbano (CLT, Art. 73)", "score": 20},
         {"value": 25, "label": "25% — Trabalho Rural (Lei nº 5.889/1973)", "score": 25}
       ]
      },
      {"id": "hora_reduzida", "type": "select", "label": "Aplicar Hora Noturna Reduzida?", "defaultValue": 1,
       "description": "No trabalho urbano, cada hora noturna de 60 minutos é computada como 52min30s (hora reduzida), aumentando o número de horas pagas. Não se aplica ao trabalho rural.",
       "options": [
         {"value": 1, "label": "Sim (Padrão para Trabalho Urbano)", "score": 1},
         {"value": 0, "label": "Não (Trabalho Rural ou Convenção Específica)", "score": 0}
       ]
      }
    ],
    "formula": {
      "type": "expression",
      "expression": "(salario_base/220)*(horas_noturnas*(1+hora_reduzida*0.1428571))*(percentual_adicional/100)",
      "resultLabel": "Valor do Adicional Noturno",
      "resultUnit": "R$",
      "decimals": 2
    }
  },
  "interpretation": {
    "ranges": [
      {"min": 0, "max": 999999, "label": "Valor Estimado do Adicional Noturno", "riskLevel": "none", "color": "#2563eb",
       "clinicalImplications": "Valor estimado do adicional noturno devido, com base no salário informado, nas horas trabalhadas em período noturno e no percentual legal aplicável.",
       "recommendations": "• Confira o valor com o holerite e o departamento pessoal\n• Verifique se a convenção coletiva da categoria prevê percentual superior ao mínimo legal\n• Em caso de dúvida, consulte o sindicato da categoria ou um profissional de contabilidade/direito trabalhista"}
    ]
  },
  "evidence": {
    "foundation": "O adicional noturno é um direito previsto no Art. 73 da CLT, garantindo ao trabalhador urbano que presta serviços entre 22h e 5h um acréscimo mínimo de 20% sobre o valor da hora diurna. Para o trabalho rural, a Lei nº 5.889/1973 prevê adicional de 25%, com período noturno diferente (agricultura: 21h às 5h; pecuária: 20h às 4h).",
    "history": "Além do percentual, o Art. 73 §1º da CLT estabelece a 'hora noturna reduzida': cada hora noturna trabalhada é computada como 52 minutos e 30 segundos, fazendo com que o número de horas pagas seja proporcionalmente maior que o número de horas de relógio efetivamente trabalhadas. Essa redução não se aplica ao trabalho rural.",
    "validation": "O valor exato pode variar conforme convenções e acordos coletivos de trabalho da categoria profissional, que frequentemente estabelecem percentuais superiores ao mínimo legal.",
    "limitations": "Esta calculadora apresenta uma estimativa simplificada, para fins educacionais e de conferência. Não substitui o cálculo oficial da folha de pagamento nem orientação de um profissional de contabilidade ou de direito trabalhista. Consulte sempre a convenção coletiva da sua categoria.",
    "references": [
      {"text": "BRASIL. Decreto-Lei nº 5.452/1943 (CLT). Art. 73 — Adicional noturno."},
      {"text": "BRASIL. Lei nº 5.889/1973 — Estatuto do Trabalhador Rural. Art. 7º."},
      {"text": "BRASIL. Constituição Federal de 1988. Art. 7º, IX."}
    ]
  },
  "learning": {
    "tips": [
      "Verifique sempre a convenção coletiva da sua categoria, que pode prever percentual de adicional noturno superior ao mínimo legal.",
      "A hora noturna reduzida (52min30s) aumenta o número de horas pagas — não esqueça de aplicá-la no trabalho urbano.",
      "O período noturno urbano vai das 22h às 5h; no trabalho rural, os horários são diferentes conforme a atividade (agricultura ou pecuária).",
      "O adicional noturno integra a remuneração para efeito de cálculo de férias, 13º salário e FGTS."
    ],
    "examples": [
      {"label": "Enfermeiro plantonista urbano", "sublabel": "Salário R$ 3.000, 40h noturnas", "emoji": "🌙",
       "values": {"salario_base": 3000, "horas_noturnas": 40, "percentual_adicional": 20, "hora_reduzida": 1}},
      {"label": "Trabalhador rural", "sublabel": "Salário R$ 1.800, 20h noturnas", "emoji": "🌾",
       "values": {"salario_base": 1800, "horas_noturnas": 20, "percentual_adicional": 25, "hora_reduzida": 0}}
    ],
    "quiz": [
      {"q": "Qual o percentual mínimo do adicional noturno para trabalhador urbano segundo a CLT?", "opts": ["10%", "20%", "25%", "50%"], "correct": 1,
       "expl": "O Art. 73 da CLT garante o mínimo de 20% de adicional noturno para o trabalhador urbano, podendo ser maior conforme convenção coletiva."},
      {"q": "O que é a 'hora noturna reduzida'?", "opts": ["Uma hora de folga extra", "Cada hora noturna de 60 minutos é computada como 52min30s para pagamento", "Redução do salário no período noturno", "Não existe esse conceito na CLT"], "correct": 1,
       "expl": "A hora noturna reduzida (Art. 73 §1º da CLT) faz com que cada hora noturna trabalhada seja paga como se fossem 60 minutos, mesmo correspondendo a apenas 52min30s reais, aumentando o total de horas pagas."},
      {"q": "A hora noturna reduzida se aplica ao trabalho rural?", "opts": ["Sim, sempre", "Não, é exclusiva do trabalho urbano", "Apenas na agricultura", "Apenas na pecuária"], "correct": 1,
       "expl": "A hora noturna reduzida é uma regra específica do trabalho urbano (CLT), não se aplicando ao trabalhador rural, regido pela Lei nº 5.889/1973."}
    ]
  },
  "faq": [
    {"q": "Esta calculadora substitui o cálculo oficial da folha de pagamento?", "a": "Não. É uma ferramenta educacional para estimativa e conferência. O cálculo oficial deve ser feito pelo departamento pessoal da empresa, considerando a convenção coletiva aplicável e demais particularidades contratuais."},
    {"q": "O adicional noturno é pago mesmo se o trabalhador iniciar o turno antes das 22h?", "a": "Sim, apenas as horas efetivamente trabalhadas dentro do período noturno legal (22h às 5h, no trabalho urbano) geram direito ao adicional noturno."}
  ],
  "about": {
    "title": "Como funciona o cálculo do Adicional Noturno",
    "html": "<p>O adicional noturno é calculado sobre o valor da hora normal do trabalhador, aplicado às horas trabalhadas em período noturno, acrescido do percentual legal (20% urbano ou 25% rural) e, no caso do trabalho urbano, da hora noturna reduzida (52min30s).</p><p><strong>Fórmula simplificada:</strong> Adicional = (Salário ÷ 220) × Horas Noturnas (ajustadas pela hora reduzida, se aplicável) × Percentual do Adicional.</p>"
  }
}
