{
  "id": "5162738f-9506-4b1c-c2d3-e4f506172839",
  "code": "SCALE-RAMSAY-001",
  "slug": "ramsay",
  "version": "1.0.0",
  "status": "published",
  "seo": {
    "title": "Escala de Ramsay - Nível de Sedação",
    "description": "Classifique o nível de sedação do paciente com a Escala de Ramsay (1 a 6 pontos). Inclui interpretação, SAE e evidências para a prática de enfermagem.",
    "canonical": "https://www.calculadorasdeenfermagem.com.br/ramsay.html"
  },
  "breadcrumb": { "category": "Terapia Intensiva", "categoryHref": "index.html#calculadoras" },
  "overview": {
    "name": "Escala de Ramsay",
    "acronym": "Ramsay",
    "categoryBadge": "Terapia intensiva",
    "icon": "i-brain",
    "objective": "Classificar o nível de sedação do paciente em uma escala de 6 pontos, orientando o ajuste da sedoanalgesia em ambiente de terapia intensiva.",
    "indication": "Indicada para pacientes sedados em UTI, especialmente sob ventilação mecânica, como uma das primeiras escalas padronizadas de sedação.",
    "targetPopulation": "Pacientes adultos criticamente enfermos, internados em UTI, sob sedação.",
    "specialty": ["Terapia Intensiva", "Enfermagem", "Anestesiologia"],
    "averageTime": "1 minuto",
    "evidenceLevel": "II",
    "originalAuthors": ["Michael A. E. Ramsay"],
    "complexity": "basic",
    "rating": 4.6,
    "ratingCount": 290
  },
  "calculator": {
    "inputs": [
      {
        "id": "nivel",
        "type": "select",
        "label": "Nível de Sedação",
        "description": "Observe o paciente e, se necessário, aplique estímulo auditivo alto ou toque glabelar leve para classificar o nível.",
        "defaultValue": 2,
        "options": [
          {"value": 1, "label": "1 — Ansioso, Agitado ou Inquieto", "score": 1, "description": "Paciente ansioso, agitado ou inquieto, sinal de sub-sedação."},
          {"value": 2, "label": "2 — Cooperativo, Orientado e Tranquilo", "score": 2, "description": "Paciente cooperativo, orientado e tranquilo, nível considerado ideal quando desperto."},
          {"value": 3, "label": "3 — Responde Apenas a Comandos", "score": 3, "description": "Paciente responde apenas a comandos verbais."},
          {"value": 4, "label": "4 — Resposta Rápida ao Estímulo", "score": 4, "description": "Resposta rápida ao leve toque glabelar ou a estímulo auditivo alto."},
          {"value": 5, "label": "5 — Resposta Lenta ao Estímulo", "score": 5, "description": "Resposta lenta ao leve toque glabelar ou a estímulo auditivo alto."},
          {"value": 6, "label": "6 — Sem Resposta", "score": 6, "description": "Nenhuma resposta ao toque glabelar ou a estímulo auditivo alto."}
        ]
      }
    ],
    "formula": {
      "type": "sum",
      "resultLabel": "Escore de Ramsay",
      "resultUnit": "",
      "decimals": 0
    }
  },
  "interpretation": {
    "ranges": [
      {"min": 1, "max": 1, "label": "Sub-sedação / Agitação", "riskLevel": "high", "color": "#dc2626",
       "clinicalImplications": "Nível de sedação insuficiente. Paciente ansioso, agitado ou inquieto, com risco de auto-extubação e remoção de dispositivos.",
       "recommendations": "• Reavaliar causas de agitação (dor, hipoxemia, delirium)\n• Comunicar à equipe médica para ajuste da sedoanalgesia\n• Garantir segurança do paciente"},
      {"min": 2, "max": 2, "label": "Sedação Adequada", "riskLevel": "none", "color": "#2563eb",
       "clinicalImplications": "Nível de sedação considerado ideal para o paciente desperto, cooperativo, orientado e tranquilo.",
       "recommendations": "• Manter conduta atual\n• Reavaliar conforme protocolo de sedação"},
      {"min": 3, "max": 4, "label": "Sedação Leve a Moderada", "riskLevel": "moderate", "color": "#ca8a04",
       "clinicalImplications": "Sedação leve a moderada, paciente responde a comandos ou estímulos com resposta rápida.",
       "recommendations": "• Verificar meta de sedação prescrita\n• Realizar interrupção diária da sedação se indicado\n• Monitorar sinais vitais"},
      {"min": 5, "max": 6, "label": "Sedação Profunda", "riskLevel": "high", "color": "#dc2626",
       "clinicalImplications": "Sedação profunda, com resposta lenta ou ausente a estímulos. Associada a maior tempo de ventilação mecânica quando prolongada sem indicação clínica.",
       "recommendations": "• Reavaliar necessidade clínica da sedação profunda\n• Considerar redução da sedação conforme protocolo\n• Monitorar sinais vitais e nível de consciência com frequência"}
    ]
  },
  "sae": {
    "nanda": [
      {"diagnosis": "Confusão aguda", "definition": "Início abrupto de perturbações reversíveis da consciência, atenção, cognição e percepção que se desenvolvem em curto período."},
      {"diagnosis": "Risco de síndrome do desuso", "definition": "Risco de deterioração dos sistemas corporais em decorrência de inatividade musculoesquelética prescrita ou inevitável."}
    ],
    "noc": [
      {"outcome": "Nível de sedação", "indicators": ["Nível de consciência adequado à meta prescrita", "Ausência de agitação", "Sinais vitais estáveis durante a sedação"]}
    ],
    "nic": [
      {"intervention": "Manejo da sedação", "activities": ["Avaliar o nível de sedação com escala validada (Ramsay)", "Ajustar infusão de sedativos conforme meta prescrita e protocolo", "Realizar interrupção diária da sedação quando indicado", "Documentar o escore a cada avaliação"]}
    ]
  },
  "evidence": {
    "foundation": "A Escala de Ramsay foi descrita por Michael Ramsay e colaboradores em 1974, sendo uma das primeiras escalas padronizadas para avaliação do nível de sedação em pacientes críticos, classificando de 1 (agitado) a 6 (sem resposta).",
    "history": "Amplamente utilizada por décadas em UTIs no mundo todo, precedendo escalas mais modernas como a RASS e a SAS (Sedation-Agitation Scale), que oferecem maior granularidade e melhor validação psicométrica.",
    "validation": "Apresenta boa aplicabilidade clínica histórica, mas estudos posteriores apontam menor confiabilidade interobservador em comparação a escalas mais recentes como a RASS, especialmente nos níveis intermediários.",
    "limitations": "Possui menor validação psicométrica formal em comparação a escalas mais modernas (RASS, SAS). Muitas instituições têm migrado para a RASS por sua maior confiabilidade e integração com a avaliação de delirium (CAM-ICU).",
    "references": [
      {"text": "RAMSAY, M. A. et al. Controlled sedation with alphaxalone-alphadolone. British Medical Journal, v. 2, n. 5920, p. 656-659, 1974."},
      {"text": "SESSLER, C. N. et al. The Richmond Agitation-Sedation Scale: validity and reliability in adult intensive care unit patients. American Journal of Respiratory and Critical Care Medicine, v. 166, n. 10, p. 1338-1344, 2002."},
      {"text": "BRUNNER, L. S.; SUDDARTH, D. S. Tratado de enfermagem médico-cirúrgica. 14ª ed. Rio de Janeiro: Guanabara Koogan, 2020."}
    ]
  },
  "learning": {
    "tips": [
      "Aplique o estímulo na sequência correta: observe primeiro, depois estímulo auditivo, depois toque glabelar leve.",
      "Muitas instituições têm substituído o Ramsay pela RASS por maior confiabilidade — verifique o protocolo local.",
      "Reavalie o escore a cada mudança na infusão de sedativos.",
      "Documente sempre o escore junto ao horário da avaliação e a meta de sedação prescrita."
    ],
    "examples": [
      {"label": "Paciente na meta ideal", "sublabel": "Ramsay 2", "emoji": "✅", "values": {"nivel": 2}},
      {"label": "Agitado, sub-sedado", "sublabel": "Ramsay 1", "emoji": "🚨", "values": {"nivel": 1}},
      {"label": "Sedação profunda", "sublabel": "Ramsay 6", "emoji": "⚠️", "values": {"nivel": 6}}
    ],
    "quiz": [
      {"q": "Qual a faixa de valores da Escala de Ramsay?", "opts": ["0 a 5", "1 a 6", "-5 a +4", "1 a 10"], "correct": 1,
       "expl": "A Escala de Ramsay varia de 1 (agitado) a 6 (sem resposta a nenhum estímulo)."},
      {"q": "Qual nível de Ramsay é considerado o estado ideal do paciente desperto?", "opts": ["Nível 1", "Nível 2", "Nível 4", "Nível 6"], "correct": 1,
       "expl": "O nível 2 (cooperativo, orientado e tranquilo) é considerado o estado ideal para o paciente desperto."},
      {"q": "Qual escala mais moderna tem substituído o Ramsay em muitas UTIs?", "opts": ["Glasgow", "RASS", "Braden", "Morse"], "correct": 1,
       "expl": "A RASS (Richmond Agitation-Sedation Scale) tem maior validação psicométrica e é hoje preferida em muitos protocolos de sedação."}
    ]
  },
  "faq": [
    {"q": "A Escala de Ramsay ainda é utilizada nas UTIs?", "a": "Sim, embora muitas instituições tenham migrado para a RASS, que possui maior validação e se integra à avaliação de delirium (CAM-ICU). A escolha da escala segue o protocolo institucional."},
    {"q": "Com que frequência a Escala de Ramsay deve ser reavaliada?", "a": "Recomenda-se reavaliação a cada turno, a cada ajuste na infusão de sedativos e sempre que houver mudança no quadro clínico do paciente."}
  ],
  "about": {
    "title": "Como funciona a Escala de Ramsay",
    "html": "<p>A Escala de Ramsay classifica o nível de sedação do paciente em 6 níveis, de 1 (ansioso e agitado) a 6 (sem resposta a qualquer estímulo), passando pelo nível 2 que representa o estado ideal do paciente desperto (cooperativo, orientado e tranquilo).</p><p><strong>Guia rápido:</strong> 1 = Sub-sedação/agitação | 2 = Sedação adequada | 3-4 = Sedação leve a moderada | 5-6 = Sedação profunda.</p>"
  }
}
